ID,text,sentiment,text_clean,label
74_0,"The Federal Open Market Committee decided today to keep its target for the federal funds rate unchanged at 1-1/4 percent. The Committee continues to believe that this accommodative stance of monetary policy, coupled with still robust underlying growth in productivity, is providing important ongoing support to economic activity. The limited number of incoming economic indicators since the November meeting, taken together, are not inconsistent with the economy working its way through its current soft spot. In these circumstances, the Committee believes that, against the background of its long-run goals of price stability and sustainable economic growth and of the information currently available, the risks are balanced with respect to the prospects for both goals for the foreseeable future.",neutral,the federal open market committee decided today to keep its target for the federal funds rate unchanged at - percent the committee continues to believe that this accommodative stance of monetary policy coupled with still robust underlying growth in productivity is providing important ongoing support to economic activity the limited number of incoming economic indicators since the november meeting taken together are not inconsistent with the economy working its way through its current soft spot in these circumstances the committee believes that against the background of its long-run goals of price stability and sustainable economic growth and of the information currently available the risks are balanced with respect to the prospects for both goals for the foreseeable future ,2
92_0,Chairman Alan Greenspan announced today that the Federal Open Market Committee decided to increase slightly the degree of pressure on reserve positions,hawkish,chairman alan greenspan announced today that the federal open market committee decided to increase slightly the degree of pressure on reserve positions,1
154_14,"The Committee will maintain the target range for the federal funds rate at 0 to 1/4 percent and continues to anticipate that economic conditions, including low rates of resource utilization, subdued inflation trends, and stable inflation expectations, are likely to warrant exceptionally low levels for the federal funds rate for an extended period",dovish,the committee will maintain the target range for the federal funds rate at to percent and continues to anticipate that economic conditions including low rates of resource utilization subdued inflation trends and stable inflation expectations are likely to warrant exceptionally low levels for the federal funds rate for an extended period,0
154_6,"Longer-term inflation expectations have remained stable, but measures of underlying inflation have continued to trend downward",neutral,longer-term inflation expectations have remained stable but measures of underlying inflation have continued to trend downward,2
33_7,"With this action, the Committee believes that, against the background of its long-run goals of price stability and sustainable economic growth and of the information currently available, the risks are balanced with respect to the prospects for both goals in the foreseeable future",neutral,with this action the committee believes that against the background of its long-run goals of price stability and sustainable economic growth and of the information currently available the risks are balanced with respect to the prospects for both goals in the foreseeable future,2
13_0,"The Federal Open Market Committee at its meeting today decided to maintain the existing stance of monetary policy, keeping its target for the federal funds rate at 6-1/2 percent",neutral,the federal open market committee at its meeting today decided to maintain the existing stance of monetary policy keeping its target for the federal funds rate at - percent,2
153_4,Employers remain reluctant to add to payrolls,dovish,employers remain reluctant to add to payrolls,0
138_1,The Federal Open Market Committee decided today to keep its target range for the federal funds rate at 0 to 1/4 percent,dovish,the federal open market committee decided today to keep its target range for the federal funds rate at to percent,0
155_0,"The Federal Open Market Committee has authorized an extension through August 1, 2011, of its temporary US dollar liquidity swap arrangements with the Bank of Canada, the Bank of England, the European Central Bank, the Bank of Japan, and the Swiss National Bank. The swap arrangements, established in May 2010, had been authorized through January 2011. Information on the actions that will be taken by other central banks is available at the following websites: Bank of Canada Bank of England European Central Bank Bank of Japan Swiss National Bank   US Dollar Liquidity Swaps--Frequently Asked Questions",dovish,the federal open market committee has authorized an extension through august of its temporary us dollar liquidity swap arrangements with the bank of canada the bank of england the european central bank the bank of japan and the swiss national bank the swap arrangements established in may had been authorized through january information on the actions that will be taken by other central banks is available at the following websites bank of canada bank of england european central bank bank of japan swiss national bank us dollar liquidity swaps--frequently asked questions,0
155_3,Information on the actions that will be taken by other central banks is available at the following websites: Bank of Canada Bank of England European Central Bank Bank of Japan Swiss National Bank   US Dollar Liquidity Swaps--Frequently Asked Questions,neutral,information on the actions that will be taken by other central banks is available at the following websites bank of canada bank of england european central bank bank of japan swiss national bank us dollar liquidity swaps--frequently asked questions,2
6_4,"As a consequence, the pool of available workers willing to take jobs has been drawn down further in recent months, a trend that must eventually be contained if inflationary imbalances are to remain in check and economic expansion continue",hawkish,as a consequence the pool of available workers willing to take jobs has been drawn down further in recent months a trend that must eventually be contained if inflationary imbalances are to remain in check and economic expansion continue,1
69_3,"Nonetheless, the degree of the strengthening in final demand over coming quarters, an essential element in sustained economic expansion, is still uncertain",dovish,nonetheless the degree of the strengthening in final demand over coming quarters an essential element in sustained economic expansion is still uncertain,0
58_4,"Although current developments do not appear to have materially diminished the prospects for long-term growth in productivity, excess productive capacity has emerged recently",dovish,although current developments do not appear to have materially diminished the prospects for long-term growth in productivity excess productive capacity has emerged recently,0
154_5,The housing sector continues to be depressed,dovish,the housing sector continues to be depressed,0
74_1,The Federal Open Market Committee decided today to keep its target for the federal funds rate unchanged at 1-1/4 percent,neutral,the federal open market committee decided today to keep its target for the federal funds rate unchanged at - percent,2
141_11,25 trillion of agency mortgage-backed securities and up to $200 billion of agency debt by the end of the year,dovish, trillion of agency mortgage-backed securities and up to billion of agency debt by the end of the year,0
119_3,We all continue to work together and will take appropriate steps to address those liquidity pressures,dovish,we all continue to work together and will take appropriate steps to address those liquidity pressures,0
10_4,"Against the background of its long-term goals of price stability and sustainable economic growth and of the information already available, the Committee believes the risks are weighted mainly toward conditions that may generate heightened inflation pressures in the foreseeable future",hawkish,against the background of its long-term goals of price stability and sustainable economic growth and of the information already available the committee believes the risks are weighted mainly toward conditions that may generate heightened inflation pressures in the foreseeable future,1
114_6,"The extent and timing of any additional firming that may be needed to address these risks will depend on the evolution of the outlook for both inflation and economic growth, as implied by incoming information",neutral,the extent and timing of any additional firming that may be needed to address these risks will depend on the evolution of the outlook for both inflation and economic growth as implied by incoming information,2
98_4,"In addition to elevating premiums for some energy products, the disruption to the production and refining infrastructure may add to energy price volatility",hawkish,in addition to elevating premiums for some energy products the disruption to the production and refining infrastructure may add to energy price volatility,1
100_1,The Federal Open Market Committee decided today to raise its target for the federal funds rate by 25 basis points to 4-1/4 percent,hawkish,the federal open market committee decided today to raise its target for the federal funds rate by basis points to - percent,1
154_15,"The Committee will continue to monitor the economic outlook and financial developments and will employ its policy tools as necessary to support the economic recovery and to help ensure that inflation, over time, is at levels consistent with its mandate",neutral,the committee will continue to monitor the economic outlook and financial developments and will employ its policy tools as necessary to support the economic recovery and to help ensure that inflation over time is at levels consistent with its mandate,2
111_2,Economic growth has been quite strong so far this year,neutral,economic growth has been quite strong so far this year,2
137_6,"In light of the declines in the prices of energy and other commodities and the weaker prospects for economic activity, the Committee expects inflation to moderate further in coming quarters",neutral,in light of the declines in the prices of energy and other commodities and the weaker prospects for economic activity the committee expects inflation to moderate further in coming quarters,2
13_4,"Moreover, the increase in energy prices, though having limited effect on core measures of prices to date, poses a risk of raising inflation expectations",hawkish,moreover the increase in energy prices though having limited effect on core measures of prices to date poses a risk of raising inflation expectations,1
30_1,The Federal Open Market Committee decided today to keep its target for the federal funds rate unchanged at 1 3/4 percent,neutral,the federal open market committee decided today to keep its target for the federal funds rate unchanged at percent,2
60_7,"With pressures on labor and product markets easing, inflation is expected to remain contained",dovish,with pressures on labor and product markets easing inflation is expected to remain contained,0
154_4,Employers remain reluctant to add to payrolls,dovish,employers remain reluctant to add to payrolls,0
149_6,"The arrangements with the Bank of England, the ECB, and the Swiss National Bank will provide these central banks with the capacity to conduct tenders of US dollars in their local markets at fixed rates for full allotment, similar to arrangements that had been in place previously",dovish,the arrangements with the bank of england the ecb and the swiss national bank will provide these central banks with the capacity to conduct tenders of us dollars in their local markets at fixed rates for full allotment similar to arrangements that had been in place previously,0
57_6,"The longer-term advances in technology and accompanying gains in productivity, however, exhibit few signs of abating and these gains, along with the lower interest rates, should support growth of the economy over time",dovish,the longer-term advances in technology and accompanying gains in productivity however exhibit few signs of abating and these gains along with the lower interest rates should support growth of the economy over time,0
119_7,The TSLF is intended to promote liquidity in the financing markets for Treasury and other collateral and thus to foster the functioning of financial markets more generally,dovish,the tslf is intended to promote liquidity in the financing markets for treasury and other collateral and thus to foster the functioning of financial markets more generally,0
94_3,"Output evidently continues to grow at a solid pace despite the rise in energy prices, and labor market conditions continue to improve gradually",neutral,output evidently continues to grow at a solid pace despite the rise in energy prices and labor market conditions continue to improve gradually,2
103_3,"The actions are intended to keep inflationary pressures contained, and thereby foster sustainable economic growth",hawkish,the actions are intended to keep inflationary pressures contained and thereby foster sustainable economic growth,1
152_8,"Measures of underlying inflation are currently at levels somewhat below those the Committee judges most consistent, over the longer run, with its mandate to promote maximum employment and price stability",dovish,measures of underlying inflation are currently at levels somewhat below those the committee judges most consistent over the longer run with its mandate to promote maximum employment and price stability,0
57_3,"Partly as a consequence, retail sales and business spending on capital equipment have weakened appreciably",dovish,partly as a consequence retail sales and business spending on capital equipment have weakened appreciably,0
36_5,"The Committee perceives that, with appropriate monetary policy action, the upside and downside risks to the attainment of both sustainable growth and price stability should be kept roughly equal",neutral,the committee perceives that with appropriate monetary policy action the upside and downside risks to the attainment of both sustainable growth and price stability should be kept roughly equal,2
58_1,"In a related action, the Board of Governors approved a 50 basis point reduction in the discount rate to 4-1/2 percent",dovish,in a related action the board of governors approved a basis point reduction in the discount rate to - percent,0
109_4,"Nevertheless, possible increases in resource utilization as well as elevated energy prices have the potential to add to inflation pressures",hawkish,nevertheless possible increases in resource utilization as well as elevated energy prices have the potential to add to inflation pressures,1
35_5,"While these unfortunate developments have increased uncertainty about near-term economic performance, it is the Committee's view that they do not pose a more persistent threat",hawkish,while these unfortunate developments have increased uncertainty about near-term economic performance it is the committee's view that they do not pose a more persistent threat,1
58_6,"In these circumstances, when the economic situation could be evolving rapidly, the Federal Reserve will need to monitor developments closely",neutral,in these circumstances when the economic situation could be evolving rapidly the federal reserve will need to monitor developments closely,2
128_3,The economy seems likely to continue to expand at a moderate pace over coming quarters,neutral,the economy seems likely to continue to expand at a moderate pace over coming quarters,2
137_2,"Since the Committee's last meeting, labor market conditions have deteriorated, and the available data indicate that consumer spending, business investment, and industrial production have declined",dovish,since the committee's last meeting labor market conditions have deteriorated and the available data indicate that consumer spending business investment and industrial production have declined,0
93_1,The Federal Open Market Committee decided today to raise its target for the federal funds rate by 25 basis points to 2-1/2 percent,hawkish,the federal open market committee decided today to raise its target for the federal funds rate by basis points to - percent,1
35_9,"The Committee perceives that, with appropriate monetary policy action, the upside and downside risks to the attainment of both sustainable growth and price stability should be kept roughly equal",neutral,the committee perceives that with appropriate monetary policy action the upside and downside risks to the attainment of both sustainable growth and price stability should be kept roughly equal,2
95_1,The Federal Open Market Committee decided today to raise its target for the federal funds rate by 25 basis points to 3 percent,hawkish,the federal open market committee decided today to raise its target for the federal funds rate by basis points to percent,1
118_4,"The Committee expects inflation to moderate in coming quarters, but it will be necessary to continue to monitor inflation developments carefully",neutral,the committee expects inflation to moderate in coming quarters but it will be necessary to continue to monitor inflation developments carefully,2
130_2,The Federal Reserve will provide reserves as necessary through open market operations to promote trading in the federal funds market at rates close to the Federal Open Market Committee's target rate of 5-1/4 percent,dovish,the federal reserve will provide reserves as necessary through open market operations to promote trading in the federal funds market at rates close to the federal open market committee's target rate of - percent,0
95_9,"Nonetheless, the Committee will respond to changes in economic prospects as needed to fulfill its obligation to maintain price stability",hawkish,nonetheless the committee will respond to changes in economic prospects as needed to fulfill its obligation to maintain price stability,1
148_0,"Information received since the Federal Open Market Committee met in March suggests that economic activity has continued to strengthen and that the labor market is beginning to improve. Growth in household spending has picked up recently but remains constrained by high unemployment, modest income growth, lower housing wealth, and tight credit. Business spending on equipment and software has risen significantly; however, investment in nonresidential structures is declining and employers remain reluctant to add to payrolls. Housing starts have edged up but remain at a depressed level. While bank lending continues to contract, financial market conditions remain supportive of economic growth. Although the pace of economic recovery is likely to be moderate for a time, the Committee anticipates a gradual return to higher levels of resource utilization in a context of price stability. With substantial resource slack continuing to restrain cost pressures and longer-term inflation expectations stable, inflation is likely to be subdued for some time. The Committee will maintain the target range for the federal funds rate at 0 to 1/4 percent and continues to anticipate that economic conditions, including low rates of resource utilization, subdued inflation trends, and stable inflation expectations, are likely to warrant exceptionally low levels of the federal funds rate for an extended period. The Committee will continue to monitor the economic outlook and financial developments and will employ its policy tools as necessary to promote economic recovery and price stability. In light of improved functioning of financial markets, the Federal Reserve has closed all but one of the special liquidity facilities that it created to support markets during the crisis. The only remaining such program, the Term Asset-Backed Securities Loan Facility, is scheduled to close on June 30 for loans backed by new-issue commercial mortgage-backed securities; it closed on March 31 for loans backed by all other types of collateral.",dovish,information received since the federal open market committee met in march suggests that economic activity has continued to strengthen and that the labor market is beginning to improve growth in household spending has picked up recently but remains constrained by high unemployment modest income growth lower housing wealth and tight credit business spending on equipment and software has risen significantly however investment in nonresidential structures is declining and employers remain reluctant to add to payrolls housing starts have edged up but remain at a depressed level while bank lending continues to contract financial market conditions remain supportive of economic growth although the pace of economic recovery is likely to be moderate for a time the committee anticipates a gradual return to higher levels of resource utilization in a context of price stability with substantial resource slack continuing to restrain cost pressures and longer-term inflation expectations stable inflation is likely to be subdued for some time the committee will maintain the target range for the federal funds rate at to percent and continues to anticipate that economic conditions including low rates of resource utilization subdued inflation trends and stable inflation expectations are likely to warrant exceptionally low levels of the federal funds rate for an extended period the committee will continue to monitor the economic outlook and financial developments and will employ its policy tools as necessary to promote economic recovery and price stability in light of improved functioning of financial markets the federal reserve has closed all but one of the special liquidity facilities that it created to support markets during the crisis the only remaining such program the term asset-backed securities loan facility is scheduled to close on june for loans backed by new-issue commercial mortgage-backed securities it closed on march for loans backed by all other types of collateral ,0
3_0,The Federal Open Market Committee today voted to raise its target for the federal funds rate 25 basis points to 5 percent,hawkish,the federal open market committee today voted to raise its target for the federal funds rate basis points to percent,1
16_2,The Board also indicated that it stands ready to approve a further reduction of 25 basis points in the discount rate to 5-1/2 percent on the requests of Federal Reserve Banks,dovish,the board also indicated that it stands ready to approve a further reduction of basis points in the discount rate to - percent on the requests of federal reserve banks,0
20_6,"This potential restraint, together with the possible effects of earlier reductions in equity wealth on consumption and the risk of slower growth abroad, continues to weigh on the economy",dovish,this potential restraint together with the possible effects of earlier reductions in equity wealth on consumption and the risk of slower growth abroad continues to weigh on the economy,0
145_15,The Federal Reserve will also be working with its central bank counterparties to close its temporary liquidity swap arrangements by February 1,neutral,the federal reserve will also be working with its central bank counterparties to close its temporary liquidity swap arrangements by february ,2
