ID,text,sentiment,text_clean,label
153_11,The Committee will maintain its existing policy of reinvesting principal payments from its securities holdings,dovish,the committee will maintain its existing policy of reinvesting principal payments from its securities holdings,0
122_5,"Over time, the substantial easing of monetary policy, combined with ongoing measures to foster market liquidity, should help to promote moderate economic growth",dovish,over time the substantial easing of monetary policy combined with ongoing measures to foster market liquidity should help to promote moderate economic growth,0
122_8,"Although downside risks to growth remain, the upside risks to inflation are also of significant concern to the Committee",hawkish,although downside risks to growth remain the upside risks to inflation are also of significant concern to the committee,1
90_2,"The Committee believes that, even after this action, the stance of monetary policy remains accommodative and, coupled with robust underlying growth in productivity, is providing ongoing support to economic activity",neutral,the committee believes that even after this action the stance of monetary policy remains accommodative and coupled with robust underlying growth in productivity is providing ongoing support to economic activity,2
5_4,"Against this background, the Committee adopted a directive that was biased toward a possible firming of policy going forward",hawkish,against this background the committee adopted a directive that was biased toward a possible firming of policy going forward,1
127_3,"Nevertheless, the economy seems likely to expand at a moderate pace over coming quarters",neutral,nevertheless the economy seems likely to expand at a moderate pace over coming quarters,2
22_0,The Federal Open Market Committee at its meeting today decided to lower its target for the federal funds rate by 25 basis points to 3-1/2 percent,dovish,the federal open market committee at its meeting today decided to lower its target for the federal funds rate by basis points to - percent,0
76_1,The Federal Open Market Committee decided today to keep its target for the federal funds rate unchanged at 1-1/4 percent,neutral,the federal open market committee decided today to keep its target for the federal funds rate unchanged at - percent,2
143_5,"Although economic activity is likely to remain weak for a time, the Committee anticipates that policy actions to stabilize financial markets and institutions, fiscal and monetary stimulus, and market forces will support a strengthening of economic growth and a gradual return to higher levels of resource utilization in a context of price stability",dovish,although economic activity is likely to remain weak for a time the committee anticipates that policy actions to stabilize financial markets and institutions fiscal and monetary stimulus and market forces will support a strengthening of economic growth and a gradual return to higher levels of resource utilization in a context of price stability,0
109_1,The Federal Open Market Committee decided today to raise its target for the federal funds rate by 25 basis points to 4-1/2 percent,hawkish,the federal open market committee decided today to raise its target for the federal funds rate by basis points to - percent,1
22_1,"In a related action, the Board of Governors approved a 25 basis point reduction in the discount rate to 3 percent",dovish,in a related action the board of governors approved a basis point reduction in the discount rate to percent,0
43_4,"Labor markets have continued to tighten over recent quarters, but strengthening productivity growth has contained inflationary pressures",neutral,labor markets have continued to tighten over recent quarters but strengthening productivity growth has contained inflationary pressures,2
157_2,The recent changes in the global economy and adjustments in US financial markets mean that a slightly lower federal funds rate should now be consistent with keeping inflation low and sustaining economic growth going forward,neutral,the recent changes in the global economy and adjustments in us financial markets mean that a slightly lower federal funds rate should now be consistent with keeping inflation low and sustaining economic growth going forward,2
157_1,The action was taken to cushion the effects on prospective economic growth in the United States of increasing weakness in foreign economies and of less accommodative financial conditions domestically,dovish,the action was taken to cushion the effects on prospective economic growth in the united states of increasing weakness in foreign economies and of less accommodative financial conditions domestically,0
119_14,The actions announced today supplement the measures announced by the Federal Reserve on Friday to boost the size of the Term Auction Facility to $100 billion and to undertake a series of term repurchase transactions that will cumulate to $100 billion,dovish,the actions announced today supplement the measures announced by the federal reserve on friday to boost the size of the term auction facility to billion and to undertake a series of term repurchase transactions that will cumulate to billion,0
41_3,"With the 75 basis point decline in the federal funds rate since September, financial conditions can reasonably be expected to be consistent with fostering sustained economic expansion while keeping inflationary pressures subdued",dovish,with the basis point decline in the federal funds rate since september financial conditions can reasonably be expected to be consistent with fostering sustained economic expansion while keeping inflationary pressures subdued,0
27_4,"Hence, the Committee continues to believe that, against the background of its long-run goals of price stability and sustainable economic growth and of the information currently available, the risks are weighted mainly toward conditions that may generate economic weakness in the foreseeable future",dovish,hence the committee continues to believe that against the background of its long-run goals of price stability and sustainable economic growth and of the information currently available the risks are weighted mainly toward conditions that may generate economic weakness in the foreseeable future,0
137_5,"Meanwhile, inflationary pressures have diminished appreciably",neutral,meanwhile inflationary pressures have diminished appreciably,2
39_2,The recent changes in the global economy and adjustments in US financial markets mean that a slightly lower federal funds rate should now be consistent with keeping inflation low and sustaining economic growth going forward,neutral,the recent changes in the global economy and adjustments in us financial markets mean that a slightly lower federal funds rate should now be consistent with keeping inflation low and sustaining economic growth going forward,2
72_4,"However, considerable uncertainty persists about the extent and timing of the expected pickup in production and employment owing in part to the emergence of heightened geopolitical risks",dovish,however considerable uncertainty persists about the extent and timing of the expected pickup in production and employment owing in part to the emergence of heightened geopolitical risks,0
25_3,"For the foreseeable future, then, the Committee continues to believe that, against the background of its long-run goals of price stability and sustainable economic growth and of the information currently available, the risks are weighted mainly toward conditions that may generate economic weakness",dovish,for the foreseeable future then the committee continues to believe that against the background of its long-run goals of price stability and sustainable economic growth and of the information currently available the risks are weighted mainly toward conditions that may generate economic weakness,0
147_2,"Household spending is expanding at a moderate rate but remains constrained by high unemployment, modest income growth, lower housing wealth, and tight credit",dovish,household spending is expanding at a moderate rate but remains constrained by high unemployment modest income growth lower housing wealth and tight credit,0
123_12,"Inflation has been high, but the Committee believes that the decline in energy and other commodity prices and the weaker prospects for economic activity have reduced the upside risks to inflation",neutral,inflation has been high but the committee believes that the decline in energy and other commodity prices and the weaker prospects for economic activity have reduced the upside risks to inflation,2
14_0,"The Federal Open Market Committee at its meeting today decided to maintain the existing stance of monetary policy, keeping its target for the federal funds rate at 6-1/2 percent",neutral,the federal open market committee at its meeting today decided to maintain the existing stance of monetary policy keeping its target for the federal funds rate at - percent,2
85_2,"The Committee continues to believe that an accommodative stance of monetary policy, coupled with robust underlying growth in productivity, is providing important ongoing support to economic activity",neutral,the committee continues to believe that an accommodative stance of monetary policy coupled with robust underlying growth in productivity is providing important ongoing support to economic activity,2
55_0,"The Federal Open Market Committee at its meeting today decided to maintain the existing stance of monetary policy, keeping its target for the federal funds rate at 6-1/2 percent",neutral,the federal open market committee at its meeting today decided to maintain the existing stance of monetary policy keeping its target for the federal funds rate at - percent,2
65_2,Heightened uncertainty and concerns about a deterioration in business conditions both here and abroad are damping economic activity,dovish,heightened uncertainty and concerns about a deterioration in business conditions both here and abroad are damping economic activity,0
140_9,The Committee will maintain the target range for the federal funds rate at 0 to 1/4 percent and anticipates that economic conditions are likely to warrant exceptionally low levels of the federal funds rate for an extended period,dovish,the committee will maintain the target range for the federal funds rate at to percent and anticipates that economic conditions are likely to warrant exceptionally low levels of the federal funds rate for an extended period,0
89_3,"Output appears to be growing at a moderate pace despite the rise in energy prices, and labor market conditions have improved",neutral,output appears to be growing at a moderate pace despite the rise in energy prices and labor market conditions have improved,2
132_7,The Committee will continue to assess the effects of these and other developments on economic prospects and will act as needed to foster price stability and sustainable economic growth,neutral,the committee will continue to assess the effects of these and other developments on economic prospects and will act as needed to foster price stability and sustainable economic growth,2
136_6,"Inflation has been high, spurred by the earlier increases in the prices of energy and some other commodities",hawkish,inflation has been high spurred by the earlier increases in the prices of energy and some other commodities,1
23_6,"For the foreseeable future, the Committee continues to believe that against the background of its long-run goals of price stability and sustainable economic growth and of the information currently available, the risks are weighted mainly toward conditions that may generate economic weakness",dovish,for the foreseeable future the committee continues to believe that against the background of its long-run goals of price stability and sustainable economic growth and of the information currently available the risks are weighted mainly toward conditions that may generate economic weakness,0
86_4,"Although incoming inflation data are somewhat elevated, a portion of the increase in recent months appears to have been due to transitory factors",hawkish,although incoming inflation data are somewhat elevated a portion of the increase in recent months appears to have been due to transitory factors,1
88_6,"With underlying inflation expected to be relatively low, the Committee believes that policy accommodation can be removed at a pace that is likely to be measured",neutral,with underlying inflation expected to be relatively low the committee believes that policy accommodation can be removed at a pace that is likely to be measured,2
3_6,"The Committee, nonetheless, recognizes that in the current dynamic environment it must be especially alert to the emergence, or potential emergence, of inflationary forces that could undermine economic growth",hawkish,the committee nonetheless recognizes that in the current dynamic environment it must be especially alert to the emergence or potential emergence of inflationary forces that could undermine economic growth,1
51_4,"In these circumstances, and against the background of its long-term goals of price stability and sustainable economic growth and of the information currently available, the Committee believes the risks continue to be weighted mainly toward conditions that may generate heightened inflation pressures in the foreseeable future",hawkish,in these circumstances and against the background of its long-term goals of price stability and sustainable economic growth and of the information currently available the committee believes the risks continue to be weighted mainly toward conditions that may generate heightened inflation pressures in the foreseeable future,1
17_7,"Nonetheless, the Committee continues to believe that against the background of its long-run goals of price stability and sustainable economic growth and of the information currently available, the risks are weighted mainly toward conditions that may generate economic weakness in the foreseeable future",dovish,nonetheless the committee continues to believe that against the background of its long-run goals of price stability and sustainable economic growth and of the information currently available the risks are weighted mainly toward conditions that may generate economic weakness in the foreseeable future,0
16_5,"Nonetheless, to date there is little evidence to suggest that longer-term advances in technology and associated gains in productivity are abating",neutral,nonetheless to date there is little evidence to suggest that longer-term advances in technology and associated gains in productivity are abating,2
90_3,"Output appears to be growing at a moderate pace despite the earlier rise in energy prices, and labor market conditions continue to improve gradually",neutral,output appears to be growing at a moderate pace despite the earlier rise in energy prices and labor market conditions continue to improve gradually,2
145_2,The housing sector has shown some signs of improvement over recent months,neutral,the housing sector has shown some signs of improvement over recent months,2
153_6,"Longer-term inflation expectations have remained stable, but measures of underlying inflation have trended lower in recent quarters",neutral,longer-term inflation expectations have remained stable but measures of underlying inflation have trended lower in recent quarters,2
60_3,"Consumption and housing expenditures have held up reasonably well, though activity in these areas has flattened recently",neutral,consumption and housing expenditures have held up reasonably well though activity in these areas has flattened recently,2
11_1,Recent data suggest that the expansion of aggregate demand may be moderating toward a pace closer to the rate of growth of the economy's potential to produce,neutral,recent data suggest that the expansion of aggregate demand may be moderating toward a pace closer to the rate of growth of the economy's potential to produce,2
60_2,A significant reduction in excess inventories seems well advanced,dovish,a significant reduction in excess inventories seems well advanced,0
99_6,"With underlying inflation expected to be contained, the Committee believes that policy accommodation can be removed at a pace that is likely to be measured",neutral,with underlying inflation expected to be contained the committee believes that policy accommodation can be removed at a pace that is likely to be measured,2
155_2,"The swap arrangements, established in May 2010, had been authorized through January 2011",neutral,the swap arrangements established in may had been authorized through january ,2
158_2,Growing caution by lenders and unsettled conditions in financial markets more generally are likely to be restraining aggregate demand in the future,dovish,growing caution by lenders and unsettled conditions in financial markets more generally are likely to be restraining aggregate demand in the future,0
153_5,Housing starts continue to be depressed,dovish,housing starts continue to be depressed,0
139_9,The Committee will maintain the target range for the federal funds rate at 0 to 1/4 percent and anticipates that economic conditions are likely to warrant exceptionally low levels of the federal funds rate for an extended period,dovish,the committee will maintain the target range for the federal funds rate at to percent and anticipates that economic conditions are likely to warrant exceptionally low levels of the federal funds rate for an extended period,0
145_13,"In light of ongoing improvements in the functioning of financial markets, the Committee and the Board of Governors anticipate that most of the Federal Reserveâs special liquidity facilities will expire on February 1, 2010, consistent with the Federal Reserveâs announcement of June 25, 2009",neutral,in light of ongoing improvements in the functioning of financial markets the committee and the board of governors anticipate that most of the federal reserveâs special liquidity facilities will expire on february consistent with the federal reserveâs announcement of june ,2
56_0,The Federal Open Market Committee decided today to lower its target for the federal funds rate by 50 basis points to 6 percent,dovish,the federal open market committee decided today to lower its target for the federal funds rate by basis points to percent,0
37_3,Core inflation has stayed relatively low in recent months and longer-term inflation expectations remain contained,neutral,core inflation has stayed relatively low in recent months and longer-term inflation expectations remain contained,2
20_5,"The erosion in current and prospective profitability, in combination with considerable uncertainty about the business outlook, seems likely to hold down capital spending going forward",dovish,the erosion in current and prospective profitability in combination with considerable uncertainty about the business outlook seems likely to hold down capital spending going forward,0
104_0,"The Federal Reserve Board today approved an increase in the discount rate from 4 percent to 4 3/4 percent, effective immediately",hawkish,the federal reserve board today approved an increase in the discount rate from percent to percent effective immediately,1
47_4,"At its next meeting the Committee will assess available information on the likely balance of supply and demand, conditions in financial markets, and the possible need for adjustment in the stance of policy to contain inflationary pressures",neutral,at its next meeting the committee will assess available information on the likely balance of supply and demand conditions in financial markets and the possible need for adjustment in the stance of policy to contain inflationary pressures,2
62_5,"Although long-term prospects for productivity growth and the economy remain favorable, the Committee continues to believe that against the background of its long-run goals of price stability and sustainable economic growth and of the information currently available, the risks are weighted mainly toward conditions that may generate economic weakness in the foreseeable future",dovish,although long-term prospects for productivity growth and the economy remain favorable the committee continues to believe that against the background of its long-run goals of price stability and sustainable economic growth and of the information currently available the risks are weighted mainly toward conditions that may generate economic weakness in the foreseeable future,0
25_0,The Federal Open Market Committee decided today to lower its target for the federal funds rate by 50 basis points to 2 percent,dovish,the federal open market committee decided today to lower its target for the federal funds rate by basis points to percent,0
148_3,"Business spending on equipment and software has risen significantly; however, investment in nonresidential structures is declining and employers remain reluctant to add to payrolls",dovish,business spending on equipment and software has risen significantly however investment in nonresidential structures is declining and employers remain reluctant to add to payrolls,0
76_5,"In light of the unusually large uncertainties clouding the geopolitical situation in the short run and their apparent effects on economic decisionmaking, the Committee does not believe it can usefully characterize the current balance of risks with respect to the prospects for its long-run goals of price stability and sustainable economic growth",neutral,in light of the unusually large uncertainties clouding the geopolitical situation in the short run and their apparent effects on economic decisionmaking the committee does not believe it can usefully characterize the current balance of risks with respect to the prospects for its long-run goals of price stability and sustainable economic growth,2
83_5,Increases in core consumer prices are muted and expected to remain low,neutral,increases in core consumer prices are muted and expected to remain low,2
98_8,"However, core inflation has been relatively low in recent months and longer-term inflation expectations remain contained",neutral,however core inflation has been relatively low in recent months and longer-term inflation expectations remain contained,2
68_3,"Nonetheless, the degree of the strengthening in final demand over coming quarters, an essential element in sustained economic expansion, is still uncertain",dovish,nonetheless the degree of the strengthening in final demand over coming quarters an essential element in sustained economic expansion is still uncertain,0
133_2,"Economic growth was solid in the third quarter, and strains in financial markets have eased somewhat on balance",neutral,economic growth was solid in the third quarter and strains in financial markets have eased somewhat on balance,2
35_1,The Federal Open Market Committee decided today to raise its target for the federal funds rate by 25 basis points to 3-3/4 percent,hawkish,the federal open market committee decided today to raise its target for the federal funds rate by basis points to - percent,1
144_8,"In these circumstances, the Federal Reserve will continue to employ a wide range of tools to promote economic recovery and to preserve price stability",dovish,in these circumstances the federal reserve will continue to employ a wide range of tools to promote economic recovery and to preserve price stability,0
156_4,"No change was made in the Federal Reserve discount rate, which remains at 5 percent",neutral,no change was made in the federal reserve discount rate which remains at percent,2
152_11,The Committee also will maintain its existing policy of reinvesting principal payments from its securities holdings,dovish,the committee also will maintain its existing policy of reinvesting principal payments from its securities holdings,0
27_3,"The degree of any strength in business capital and household spending, however, is still uncertain",neutral,the degree of any strength in business capital and household spending however is still uncertain,2
129_6,"However, a sustained moderation in inflation pressures has yet to be convincingly demonstrated",hawkish,however a sustained moderation in inflation pressures has yet to be convincingly demonstrated,1
146_16,The anticipated expiration dates for the Term Asset-Backed Securities Loan Facility remain set at June 30 for loans backed by new-issue commercial mortgage-backed securities and March 31 for loans backed by all other types of collateral,neutral,the anticipated expiration dates for the term asset-backed securities loan facility remain set at june for loans backed by new-issue commercial mortgage-backed securities and march for loans backed by all other types of collateral,2
77_5,"Although the timing and extent of that improvement remain uncertain, the Committee perceives that over the next few quarters the upside and downside risks to the attainment of sustainable growth are roughly equal",neutral,although the timing and extent of that improvement remain uncertain the committee perceives that over the next few quarters the upside and downside risks to the attainment of sustainable growth are roughly equal,2
99_3,"However, monetary policy accommodation, coupled with robust underlying growth in productivity, is providing ongoing support to economic activity that will likely be augmented by planned rebuilding in the hurricane-affected areas",neutral,however monetary policy accommodation coupled with robust underlying growth in productivity is providing ongoing support to economic activity that will likely be augmented by planned rebuilding in the hurricane-affected areas,2
