ID,text,sentiment,text_clean,label
76_0,"The Federal Open Market Committee decided today to keep its target for the federal funds rate unchanged at 1-1/4 percent. While incoming economic data since the January meeting have been mixed, recent labor market indicators have proven disappointing. However, the hesitancy of the economic expansion appears to owe importantly to oil price premiums and other aspects of geopolitical uncertainties. The Committee believes that as those uncertainties lift, as most analysts expect, the accommodative stance of monetary policy, coupled with ongoing growth in productivity, will provide support to economic activity sufficient to engender an improving economic climate over time. In light of the unusually large uncertainties clouding the geopolitical situation in the short run and their apparent effects on economic decisionmaking, the Committee does not believe it can usefully characterize the current balance of risks with respect to the prospects for its long-run goals of price stability and sustainable economic growth. Rather, the Committee decided to refrain from making that determination until some of those uncertainties abate. In the current circumstances, heightened surveillance is particularly informative.",dovish,the federal open market committee decided today to keep its target for the federal funds rate unchanged at - percent while incoming economic data since the january meeting have been mixed recent labor market indicators have proven disappointing however the hesitancy of the economic expansion appears to owe importantly to oil price premiums and other aspects of geopolitical uncertainties the committee believes that as those uncertainties lift as most analysts expect the accommodative stance of monetary policy coupled with ongoing growth in productivity will provide support to economic activity sufficient to engender an improving economic climate over time in light of the unusually large uncertainties clouding the geopolitical situation in the short run and their apparent effects on economic decisionmaking the committee does not believe it can usefully characterize the current balance of risks with respect to the prospects for its long-run goals of price stability and sustainable economic growth rather the committee decided to refrain from making that determination until some of those uncertainties abate in the current circumstances heightened surveillance is particularly informative ,0
27_0,The Federal Open Market Committee decided today to keep its target for the federal funds rate unchanged at 1-3/4 percent,neutral,the federal open market committee decided today to keep its target for the federal funds rate unchanged at - percent,2
147_10,"25 trillion of agency mortgage-backed securities and about $175 billion of agency debt; those purchases are nearing completion, and the remaining transactions will be executed by the end of this month",dovish, trillion of agency mortgage-backed securities and about billion of agency debt those purchases are nearing completion and the remaining transactions will be executed by the end of this month,0
117_4,"Moreover, incoming information indicates a deepening of the housing contraction as well as some softening in labor markets",dovish,moreover incoming information indicates a deepening of the housing contraction as well as some softening in labor markets,0
153_7,"Consistent with its statutory mandate, the Committee seeks to foster maximum employment and price stability",neutral,consistent with its statutory mandate the committee seeks to foster maximum employment and price stability,2
140_8,"In these circumstances, the Federal Reserve will employ all available tools to promote economic recovery and to preserve price stability",dovish,in these circumstances the federal reserve will employ all available tools to promote economic recovery and to preserve price stability,0
33_3,"The Committee continues to believe that an accommodative stance of monetary policy, coupled with still-robust underlying growth in productivity, is providing important ongoing support to economic activity",dovish,the committee continues to believe that an accommodative stance of monetary policy coupled with still-robust underlying growth in productivity is providing important ongoing support to economic activity,0
151_8,"The Committee will maintain the target range for the federal funds rate at 0 to 1/4 percent and continues to anticipate that economic conditions, including low rates of resource utilization, subdued inflation trends, and stable inflation expectations, are likely to warrant exceptionally low levels of the federal funds rate for an extended period",dovish,the committee will maintain the target range for the federal funds rate at to percent and continues to anticipate that economic conditions including low rates of resource utilization subdued inflation trends and stable inflation expectations are likely to warrant exceptionally low levels of the federal funds rate for an extended period,0
29_3,"However, both the upward impetus from the swing in inventory investment and the growth in final demand appear to have moderated",neutral,however both the upward impetus from the swing in inventory investment and the growth in final demand appear to have moderated,2
150_2,"Household spending is increasing but remains constrained by high unemployment, modest income growth, lower housing wealth, and tight credit",dovish,household spending is increasing but remains constrained by high unemployment modest income growth lower housing wealth and tight credit,0
105_3,"In these circumstances, the Federal Reserve views these actions as necessary to keep inflation contained, and thereby foster sustainable economic growth",neutral,in these circumstances the federal reserve views these actions as necessary to keep inflation contained and thereby foster sustainable economic growth,2
153_1,Information received since the Federal Open Market Committee met in September confirms that the pace of recovery in output and employment continues to be slow,dovish,information received since the federal open market committee met in september confirms that the pace of recovery in output and employment continues to be slow,0
146_14,"In addition, the temporary liquidity swap arrangements between the Federal Reserve and other central banks will expire on February 1",neutral,in addition the temporary liquidity swap arrangements between the federal reserve and other central banks will expire on february ,2
86_3,The evidence accumulated over the intermeeting period indicates that output is continuing to expand at a solid pace and labor market conditions have improved,neutral,the evidence accumulated over the intermeeting period indicates that output is continuing to expand at a solid pace and labor market conditions have improved,2
69_0,"The Federal Open Market Committee decided today to keep its target for the federal funds rate unchanged at 1 3/4 percent. The information that has become available since the last meeting of the Committee confirms that economic activity has been receiving considerable upward impetus from a marked swing in inventory investment. Nonetheless, the degree of the strengthening in final demand over coming quarters, an essential element in sustained economic expansion, is still uncertain. In these circumstances, although the stance of monetary policy is currently accommodative, the Committee believes that, for the foreseeable future, against the background of its long run goals of price stability and sustainable economic growth and of the information currently available, the risks are balanced with respect to the prospects for both goals.",neutral,the federal open market committee decided today to keep its target for the federal funds rate unchanged at percent the information that has become available since the last meeting of the committee confirms that economic activity has been receiving considerable upward impetus from a marked swing in inventory investment nonetheless the degree of the strengthening in final demand over coming quarters an essential element in sustained economic expansion is still uncertain in these circumstances although the stance of monetary policy is currently accommodative the committee believes that for the foreseeable future against the background of its long run goals of price stability and sustainable economic growth and of the information currently available the risks are balanced with respect to the prospects for both goals ,2
62_0,The Federal Open Market Committee at its meeting today decided to lower its target for the federal funds rate by 25 basis points to 3-1/2 percent,dovish,the federal open market committee at its meeting today decided to lower its target for the federal funds rate by basis points to - percent,0
119_6,"Under this new Term Securities Lending Facility (TSLF), the Federal Reserve will lend up to $200 billion of Treasury securities to primary dealers secured for a term of 28 days (rather than overnight, as in the existing program) by a pledge of other securities, including federal agency debt, federal agency residential-mortgage-backed securities (MBS), and non-agency AAA/Aaa-rated private-label residential MBS",dovish,under this new term securities lending facility tslf the federal reserve will lend up to billion of treasury securities to primary dealers secured for a term of days rather than overnight as in the existing program by a pledge of other securities including federal agency debt federal agency residential-mortgage-backed securities mbs and non-agency aaa aaa-rated private-label residential mbs,0
143_9,"To provide support to mortgage lending and housing markets and to improve overall conditions in private credit markets, the Federal Reserve will purchase a total of $1",dovish,to provide support to mortgage lending and housing markets and to improve overall conditions in private credit markets the federal reserve will purchase a total of ,0
59_2,The FOMC has reviewed prospects for the economy in light of the information that has become available since its March meeting,neutral,the fomc has reviewed prospects for the economy in light of the information that has become available since its march meeting,2
58_5,The possibility that this excess could continue for some time and the potential for weakness in global economic conditions suggest substantial risks that demand and production could remain soft,dovish,the possibility that this excess could continue for some time and the potential for weakness in global economic conditions suggest substantial risks that demand and production could remain soft,0
78_5,"The economy, nonetheless, has yet to exhibit sustainable growth",dovish,the economy nonetheless has yet to exhibit sustainable growth,0
140_3,"Weak sales prospects and difficulties in obtaining credit have led businesses to cut back on inventories, fixed investment, and staffing",dovish,weak sales prospects and difficulties in obtaining credit have led businesses to cut back on inventories fixed investment and staffing,0
73_6,"In these circumstances, the Committee believes that today's additional monetary easing should prove helpful as the economy works its way through this current soft spot",dovish,in these circumstances the committee believes that today's additional monetary easing should prove helpful as the economy works its way through this current soft spot,0
102_0,The Federal Reserve today announced two actions designed to maintain favorable trends in inflation and thereby sustain the economic expansion,hawkish,the federal reserve today announced two actions designed to maintain favorable trends in inflation and thereby sustain the economic expansion,1
105_1,"In a related move, the Federal Open Market Committee agreed that this increase should be reflected fully in interest rates in the reserve markets",hawkish,in a related move the federal open market committee agreed that this increase should be reflected fully in interest rates in the reserve markets,1
82_5,The Committee perceives that the upside and downside risks to the attainment of sustainable growth for the next few quarters are roughly equal,neutral,the committee perceives that the upside and downside risks to the attainment of sustainable growth for the next few quarters are roughly equal,2
45_2,"Nonetheless, the growth of demand has continued to outpace that of supply, as evidenced by a decreasing pool of available workers willing to take jobs",hawkish,nonetheless the growth of demand has continued to outpace that of supply as evidenced by a decreasing pool of available workers willing to take jobs,1
77_4,"These developments, along with the accommodative stance of monetary policy and ongoing growth in productivity, should foster an improving economic climate over time",neutral,these developments along with the accommodative stance of monetary policy and ongoing growth in productivity should foster an improving economic climate over time,2
146_0,"Information received since the Federal Open Market Committee met in December suggests that economic activity has continued to strengthen and that the deterioration in the labor market is abating. Household spending is expanding at a moderate rate but remains constrained by a weak labor market, modest income growth, lower housing wealth, and tight credit. Business spending on equipment and software appears to be picking up, but investment in structures is still contracting and employers remain reluctant to add to payrolls. Firms have brought inventory stocks into better alignment with sales. While bank lending continues to contract, financial market conditions remain supportive of economic growth. Although the pace of economic recovery is likely to be moderate for a time, the Committee anticipates a gradual return to higher levels of resource utilization in a context of price stability. With substantial resource slack continuing to restrain cost pressures and with longer-term inflation expectations stable, inflation is likely to be subdued for some time. The Committee will maintain the target range for the federal funds rate at 0 to 1/4 percent and continues to anticipate that economic conditions, including low rates of resource utilization, subdued inflation trends, and stable inflation expectations, are likely to warrant exceptionally low levels of the federal funds rate for an extended period. To provide support to mortgage lending and housing markets and to improve overall conditions in private credit markets, the Federal Reserve is in the process of purchasing $1.25 trillion of agency mortgage-backed securities and about $175 billion of agency debt. In order to promote a smooth transition in markets, the Committee is gradually slowing the pace of these purchases, and it anticipates that these transactions will be executed by the end of the first quarter. The Committee will continue to evaluate its purchases of securities in light of the evolving economic outlook and conditions in financial markets. In light of improved functioning of financial markets, the Federal Reserve will be closing the Asset-Backed Commercial Paper Money Market Mutual Fund Liquidity Facility, the Commercial Paper Funding Facility, the Primary Dealer Credit Facility, and the Term Securities Lending Facility on February 1, as previously announced. In addition, the temporary liquidity swap arrangements between the Federal Reserve and other central banks will expire on February 1. The Federal Reserve is in the process of winding down its Term Auction Facility: $50 billion in 28-day credit will be offered on February 8 and $25 billion in 28-day credit will be offered at the final auction on March 8. The anticipated expiration dates for the Term Asset-Backed Securities Loan Facility remain set at June 30 for loans backed by new-issue commercial mortgage-backed securities and March 31 for loans backed by all other types of collateral. The Federal Reserve is prepared to modify these plans if necessary to support financial stability and economic growth.",dovish,information received since the federal open market committee met in december suggests that economic activity has continued to strengthen and that the deterioration in the labor market is abating household spending is expanding at a moderate rate but remains constrained by a weak labor market modest income growth lower housing wealth and tight credit business spending on equipment and software appears to be picking up but investment in structures is still contracting and employers remain reluctant to add to payrolls firms have brought inventory stocks into better alignment with sales while bank lending continues to contract financial market conditions remain supportive of economic growth although the pace of economic recovery is likely to be moderate for a time the committee anticipates a gradual return to higher levels of resource utilization in a context of price stability with substantial resource slack continuing to restrain cost pressures and with longer-term inflation expectations stable inflation is likely to be subdued for some time the committee will maintain the target range for the federal funds rate at to percent and continues to anticipate that economic conditions including low rates of resource utilization subdued inflation trends and stable inflation expectations are likely to warrant exceptionally low levels of the federal funds rate for an extended period to provide support to mortgage lending and housing markets and to improve overall conditions in private credit markets the federal reserve is in the process of purchasing trillion of agency mortgage-backed securities and about billion of agency debt in order to promote a smooth transition in markets the committee is gradually slowing the pace of these purchases and it anticipates that these transactions will be executed by the end of the first quarter the committee will continue to evaluate its purchases of securities in light of the evolving economic outlook and conditions in financial markets in light of improved functioning of financial markets the federal reserve will be closing the asset-backed commercial paper money market mutual fund liquidity facility the commercial paper funding facility the primary dealer credit facility and the term securities lending facility on february as previously announced in addition the temporary liquidity swap arrangements between the federal reserve and other central banks will expire on february the federal reserve is in the process of winding down its term auction facility billion in -day credit will be offered on february and billion in -day credit will be offered at the final auction on march the anticipated expiration dates for the term asset-backed securities loan facility remain set at june for loans backed by new-issue commercial mortgage-backed securities and march for loans backed by all other types of collateral the federal reserve is prepared to modify these plans if necessary to support financial stability and economic growth ,0
20_8,"Although measured productivity growth stalled in the first quarter, the impressive underlying rate of increase that developed in recent years appears to be largely intact, supporting longer-term prospects",dovish,although measured productivity growth stalled in the first quarter the impressive underlying rate of increase that developed in recent years appears to be largely intact supporting longer-term prospects,0
144_10,"To provide support to mortgage lending and housing markets and to improve overall conditions in private credit markets, the Federal Reserve will purchase a total of $1",dovish,to provide support to mortgage lending and housing markets and to improve overall conditions in private credit markets the federal reserve will purchase a total of ,0
161_2,Such trends could foster inflationary imbalances that would undermine the economy's exemplary performance,hawkish,such trends could foster inflationary imbalances that would undermine the economy's exemplary performance,1
109_6,"In any event, the Committee will respond to changes in economic prospects as needed to foster these objectives",neutral,in any event the committee will respond to changes in economic prospects as needed to foster these objectives,2
149_4,Central banks will continue to work together closely as needed to address pressures in funding markets,dovish,central banks will continue to work together closely as needed to address pressures in funding markets,0
10_3,"The Committee is concerned that this disparity in the growth of demand and potential supply will continue, which could foster inflationary imbalances that would undermine the economy's outstanding performance",hawkish,the committee is concerned that this disparity in the growth of demand and potential supply will continue which could foster inflationary imbalances that would undermine the economy's outstanding performance,1
108_4,"With price and cost trends already subdued, a slight easing of monetary policy is consistent with contained inflation and sustainable growth",dovish,with price and cost trends already subdued a slight easing of monetary policy is consistent with contained inflation and sustainable growth,0
45_1,"Strengthening productivity growth has been fostering favorable trends in unit costs and prices, and much recent information suggests that these trends have been sustained",neutral,strengthening productivity growth has been fostering favorable trends in unit costs and prices and much recent information suggests that these trends have been sustained,2
111_7,"In any event, the Committee will respond to changes in economic prospects as needed to support the attainment of its objectives",neutral,in any event the committee will respond to changes in economic prospects as needed to support the attainment of its objectives,2
138_7,"The Committee anticipates that a gradual recovery in economic activity will begin later this year, but the downside risks to that outlook are significant",dovish,the committee anticipates that a gradual recovery in economic activity will begin later this year but the downside risks to that outlook are significant,0
143_13,The Committee will continue to evaluate the timing and overall amounts of its purchases of securities in light of the evolving economic outlook and conditions in financial markets,neutral,the committee will continue to evaluate the timing and overall amounts of its purchases of securities in light of the evolving economic outlook and conditions in financial markets,2
150_4,Housing starts remain at a depressed level,dovish,housing starts remain at a depressed level,0
26_5,"Although the necessary reallocation of resources to enhance security may restrain advances in productivity for a time, the long-term prospects for productivity growth and the economy remain favorable and should become evident once the unusual forces restraining demand abate",dovish,although the necessary reallocation of resources to enhance security may restrain advances in productivity for a time the long-term prospects for productivity growth and the economy remain favorable and should become evident once the unusual forces restraining demand abate,0
75_2,Oil price premiums and other aspects of geopolitical risks have reportedly fostered continued restraint on spending and hiring by businesses,dovish,oil price premiums and other aspects of geopolitical risks have reportedly fostered continued restraint on spending and hiring by businesses,0
66_5,"Although the necessary reallocation of resources to enhance security may restrain advances in productivity for a time, the long-term prospects for productivity growth and the economy remain favorable and should become evident once the unusual forces restraining demand abate",dovish,although the necessary reallocation of resources to enhance security may restrain advances in productivity for a time the long-term prospects for productivity growth and the economy remain favorable and should become evident once the unusual forces restraining demand abate,0
122_1,The Federal Open Market Committee decided today to keep its target for the federal funds rate at 2 percent,neutral,the federal open market committee decided today to keep its target for the federal funds rate at percent,2
160_0,The Federal Open Market Committee today voted to raise its target for the federal funds rate by 25 basis points to 5-1/2 percent,hawkish,the federal open market committee today voted to raise its target for the federal funds rate by basis points to - percent,1
151_7,"Measures of underlying inflation have trended lower in recent quarters and, with substantial resource slack continuing to restrain cost pressures and longer-term inflation expectations stable, inflation is likely to be subdued for some time",neutral,measures of underlying inflation have trended lower in recent quarters and with substantial resource slack continuing to restrain cost pressures and longer-term inflation expectations stable inflation is likely to be subdued for some time,2
47_1,"Based on the available evidence, however, the Committee remains concerned with the possibility that over time increases in demand will continue to exceed the growth in potential supply, even after taking account of the remarkable rise in productivity growth",hawkish,based on the available evidence however the committee remains concerned with the possibility that over time increases in demand will continue to exceed the growth in potential supply even after taking account of the remarkable rise in productivity growth,1
